ecg_concept,surrol_mechanism,example_failure,evidence_signals,route,intervention,primary_metric,limitation
VT/VF boundary-first gate,grasp_contact_or_unsafe_boundary,jaw_stuck_open; near_target_unsafe_recovery,close_command_count; progress_stall; danger_zone_distance; no_improvement_after_grasp,human_review_or_abort_candidate,observable_retry_or_stop,high_risk_failure_capture_at_budget,observable proxy is not a validated sensor model
representation_conflict,policy_outcome_conflict,execution_slip; object_drop_after_grasp,expected_progress_vs_actual_progress; action_norm; policy_or_oracle_gap; reliability_memory_distance,auto_recovery_or_human_review,short_window_recovery_or_replan,route_specific_success,recovery primitive may still be scripted
atypical_signal,visual_or_state_atypicality,perception_bias; depth_scale_error; object_dropout,visual_corruption_score; depth_residual; state_reestimate_delta; memory_distance,human_review,reestimate_state_or_request_review,residual_auto_path_error,state corruption is proxy not real perception
hidden_confident_error,confident_action_wrong_outcome,close_command_without_grasp; high_confidence_no_progress,low_action_uncertainty; repeated_command; no_object_progress; final_distance_stall,human_review_or_observable_retry,retry_grasp_or_pause,mechanism_alignment,confidence source may be unavailable for scripted policy
signal_quality_or_ood,observation_quality_failure,occlusion; brightness_shift; depth_noise,frame_quality; adapter_residual; visual_feature_shift; missing_object_signal,human_review,reacquire_or_reestimate,review_capture_at_budget,rendered visual features are simplified
fixed_budget_review,limited_intervention_budget,all_failure_families,ranked_mechanism_score; route_priority; budget_fraction,mechanism_router,select_top_risk_steps_or_episodes,capture_rate_at_10_20_30pct,offline budget evaluation precedes deployable policy
residual_budget_reserve,v5d_style_two_stage_router,mixed_failure_suite,boundary_score; residual_mechanism_score; route_counts,boundary_first_then_residual,boundary_gate_plus_reserved_residual_slots,unresolved_high_risk_failure_rate,requires enough diverse failures for calibration
